### ISSUE TITLE
Flipped ICMP Echo request/reply connection direction

### ISSUE THREAD

**Issue by ma-fl** [zeek/zeek#5830]
If zeek misses the first ICMP echo request the connection is logged with flipped orig and resp. This makes it difficult to deal with when trying to determine the source and destination of further ICMP echo packets between the involved hosts. It should be possible to 'recover' the direction based on the ICMP types (8 and 0 for ICMP over IPv4, IPv6 should work similar), similar to the behavior for well known TCP ports. This would especially be helpful for zeek scripting, where it would eliminate the requirement for a workaround such as the following for further ICMP requests for example:

```
local echo_req_type = info$v6 ? 128 : 8;   # ICMPv4 echo request is 8, ICMPv6 echo request is 128
local from_orig = port_to_count(c$id$orig_p) == echo_req_type;   # types are recorded in the ports for ICMP
local src = from_orig ? c$id$orig_h : c$id$resp_h;   # recover orig
local dst = from_orig ? c$id$resp_h : c$id$orig_h;   # recover resp
```

There is an example PCAP attached, which contains a sequence of ICMP echo request / reply pairs. The first echo request is missing, leading to the flipped connection when parsed.

```
$ tcpdump -nr two-pings-1st-request-missing.pcap
reading from file two-pings-1st-request-missing.pcap, link-type EN10MB (Ethernet), snapshot length 262144
13:18:48.607314 IP 192.168.120.61 > 192.168.120.62: ICMP echo reply, id 7, seq 1, length 64
13:18:56.215246 IP 192.168.120.62 > 192.168.120.61: ICMP echo request, id 8, seq 1, length 64
13:18:56.215407 IP 192.168.120.61 > 192.168.120.62: ICMP echo reply, id 8, seq 1, length 64
```

Produces the following conn.log:

```
#fields ts      uid     id.orig_h       id.orig_p       id.resp_h       id.resp_p       proto   service duration       orig_bytes       resp_bytes      conn_state      local_orig      local_resp      missed_bytes    history orig_pkts      orig_ip_bytes    resp_pkts       resp_ip_bytes   tunnel_parents  ip_proto
#types  time    string  addr    port    addr    port    enum    string  interval        count   count   string  bool   bool     count   string  count   count   count   count   set[string]     count
1787224728.607314       ClmLWg3LmmfobhPE8f      192.168.120.61  0       192.168.120.62  8       icmp    -       7.608093112     56      OTH     T       T       0       -       2       168     1       84      -       1
```

The expectation would be to see this corrected to

orig_h = 192.168.120.62
orig_p = 8
resp_h = 192.168.120.61
resp_p = 0

This is not a bug, but more a feature request.

[two-pings-1st-request-missing.zip](https://github.com/user-attachments/files/31428972/two-pings-1st-request-missing.zip)

**Comment by ckreibich** [comment]
Thanks! Yeah, Zeek has a detailed "[map](https://github.com/zeek/zeek/blob/master/src/packet_analysis/protocol/icmp/ICMP.cc#L815-L872)" of ICMP types and codes and how/when these relate to connection directionality — often that feels a bit odd, but here it'll be helpful. Your observation also holds for ICMPv6.

Thanks for including a pcap!
